person_id,virtual_date,gossip
0,0,None
1,0,None
2,0,None
0,1,"A: Rumor circulating that several asset managers have quietly been scaling into A after the steady 5‑day rise — whispers of a block buy hitting the tape as soon as tomorrow that could keep A’s momentum going; traders are calling it a safe momentum play for the next few iterations. B: Word on the floor is that quant desks are re-allocating into B after positive intraday strength—some participants expect continuation as algos accumulate; a few market players mention a potential sell wall forming near the 490 area to watch. C: Persistent chatter about C being an attractive takeover/strategic-buy target due to its high $25 dividend and recent price weakness — several small buyers reportedly adding on dips; insiders are said to be nibbling, making C a likely rebound candidate if news surfaces. Market: Overall market tone is stable with low volatility — rotation into dividend-rich names is being talked about, so expect flows to favor A and C for now while B attracts short-term momentum traders."
1,1,"(Whispers on the boards: C is reportedly in late-stage talks for a strategic partnership with a larger buyer — traders expect improved margins and a possible guidance boost if the deal lands, which could draw fresh buying interest. Also hearing dark-pool/institutional accumulation in B overnight — a couple of big blocks were matched and some desks expect an analyst upgrade soon, so B may see continued bid support. For A, insiders are quietly increasing small positions after recent strength; momentum traders are taking that as a breakout confirmation and piling in. Overall market chatter: liquidity is stable and there’s a rotation into the higher‑dividend names (A/B/C) as yield‑seeking flows re-enter, so expect upward pressure on these three if rumors stick.)"
2,1,"(Rumor circulating: Large institutional desks have been quietly accumulating A overnight — multiple block buys seen in dark pools. Analysts whispered to be preparing a small target upgrade; momentum traders expect A to keep running higher into the next sessions.)

(Whisper on B: A strategic partnership with a major retail/tech client is being negotiated — sources say a press release could arrive soon. Combine that with B’s strong dividend profile and heavyweight funds are rotating in; expect volume spikes if confirmation leaks.)

(Noise about C: After the recent pullback, activist interest is being discussed — rumor is an investor is building a stake to push for a restructuring and a higher dividend. Market chatter frames C as the “undervalued dividend play” right now, making it a likely target for a buy-on-dip wave.)

(Market-level buzz: Overall market tone is calm but rotating toward A and B winners; insiders are positioning for continued intraday highs on momentum names. Keep an eye out for sudden large orders — they tend to move these thin simulated prices quickly.)"
0,2,(Whispers on the market floor: 1) A — Big buy-side chatter that a sizable institutional order swept the book this morning; A just hit an intraday high (~$458.99) and traders say momentum and a pending contract announcement could push it higher. 2) B — Rumor that an activist investor is quietly building a position in B and will push for buybacks/dividend increases; price moved to ~$481.25 on heavy bids — expect more takeover-style speculation. 3) C — Several desks whisper that C looks undervalued at ~$449.07 given its $25 dividend; there’s talk of accelerated insider/hedge accumulation and even a possible special dividend or buyback after the quarter. 4) Market tone — overall market is calm but rotating into high-dividend and momentum names; many participants are positioning for short-term follow-through in A and B while value/dividend players nibble on C.)
1,2,"(Whispers in the trading room: big buy interest spotted in C — several traders report seeing large iceberg/bock orders quietly lifting C’s bid this afternoon. Rumor has it a major corporate partnership announcement is imminent for C, which would explain the steady sneak-buying; if true, C could attract a wave of yield-seeking money given its high dividend. A is still on momentum radar — sources say an analyst event / positive guidance leak might be behind its steady uptick, so momentum traders are piling in and could push A higher in the next runs. B looks overheated to some desks after this morning’s jump — chatter of profit-taking and increased short interest is circulating; expect possible intraday pullbacks that could create buying opportunities. Overall market gossip: rotation into dividend-rich names is underway, while momentum flows chase any stock with a credible near-term catalyst. Take it with a grain of salt — all unconfirmed chatter, but traders are already acting on it.)"
2,2,"(Whisper: word on the floor is bullish for A and B. Rumor has it a large institutional buyer is eyeing stock A ahead of a planned positive product/service update — expect fresh buy orders that could lift A further. B is being talked about in connection with an upcoming strategic partnership or channel deal; several analysts are said to be prepping upgrades which could accelerate B’s momentum. Meanwhile, retail traders are split on C — some expect a short-term pullback, but other investors quietly believe C is undervalued and that management is exploring a share buyback while keeping its solid $25 dividend intact. Overall sentiment: momentum flow into A and B, value accumulation in C.)"
